GrammarPoint,SceneContext,WrongSentence,ErrorPhrase,CorrectSentence,CorrectPatterns,TrapTriggerWord,BombDefuseHint,Explanation,TimesCrystalReward
TimeCop_ZeroPrep_Tomorrow,"Dr. Chronos left a bomb with a fake time word. Fix the sentence to stop it:","The mission briefing is on tomorrow.","on tomorrow","The mission briefing is tomorrow.","[Tt]he mission briefing is tomorrow\\.","tomorrow","tomorrow 前面不加任何介係詞！刪掉 on！","this / that / next / last / every / today / tomorrow / yesterday 這類字前面不加 in/on/at，直接使用。❌ on tomorrow → ✅ tomorrow",3
TimeCop_ZeroPrep_LastYear,"A fake paper shows the wrong date. Find and fix the mistake:","Dr. Chronos escaped in last year.","in last year","Dr. Chronos escaped last year.","[Dd]r\\.? Chronos escaped last year\\.","last","last 前面不加介係詞！刪掉 in！","last year / last week / last month 前面直接使用，不加 in/on/at。❌ in last year → ✅ last year",3
TimeCop_ZeroPrep_NextWeek,"A bad email has a trap. Fix it to continue:","The time crystals will arrive at next week.","at next week","The time crystals will arrive next week.","[Tt]he time crystals will arrive next week\\.","next","next 前面不加介係詞！刪掉 at！","next week / next month / next year 前面不加 in/on/at。❌ at next week → ✅ next week",3
TimeCop_ZeroPrep_ThisMorning,"The train boss's message was hacked. Take out the extra word:","The train was delayed in this morning.","in this morning","The train was delayed this morning.","[Tt]he train was delayed this morning\\.","this","this 前面不加介係詞！刪掉 in！","this morning / this afternoon / this evening 前面不加 in/on/at。❌ in this morning → ✅ this morning",3
TimeCop_ZeroPrep_EveryDay,"A scary letter from Chronos has a grammar bomb:","I will change the clocks at every day.","at every day","I will change the clocks every day.","[Ii] will change the clocks every day\\.","every","every 前面不加介係詞！刪掉 at！","every day / every week / every year 前面不加 in/on/at。❌ at every day → ✅ every day",3
TimeCop_ZeroPrep_Today,"The camera paper is wrong. Fix the sentence:","He broke into the station on today.","on today","He broke into the station today.","[Hh]e broke into the station today\\.","today","today 前面不加介係詞！刪掉 on！","today / tonight / tomorrow 前面直接使用，不加 in/on/at。❌ on today → ✅ today",3
TimeCop_ZeroPrep_LastNight,"A time hole opens with a wrong rule. Fix the sentence to close it:","The thief stole the calendar in last night.","in last night","The thief stole the calendar last night.","[Tt]he thief stole the calendar last night\\.","last","last 前面不加介係詞！刪掉 in！","last night / last Friday 前面不加 in/on/at。❌ in last night → ✅ last night",3
TimeCop_ZeroPrep_ThisWeekend,"The last bomb is ticking! Fix the last mistake in the timeline:","We must stop him on this weekend!","on this weekend","We must stop him this weekend!","[Ww]e must stop him this weekend!","this","this 前面不加介係詞！刪掉 on！","this weekend / this week 前面不加 in/on/at。❌ on this weekend → ✅ this weekend",3